{
  "schema_version": "1.0",
  "trial_id": "dont_tap.t008",
  "module_id": "dont_tap",
  "episode_id": null,
  "block_id": "dont_tap.main",
  "trial_index": 8,
  "trial_type": "nogo",
  "phase": "main",
  "condition_id": "standard",
  "calibration_level": "L2",
  "response_window_ms": 900,
  "stimulus_id": "stall.item.spoiled_mango",
  "vocabulary": ["serve", "withhold"],
  "voice_vocabulary": [],
  "audio_keys": ["dont_tap.prompt.serve"],
  "private_report": false,
  "anchor_trial": true,
  "form_id": "form_1",
  "probe_group_id": null,
  "scorable": true,
  "expected_response": "withhold",
  "latency_anchor": "visual_onset",
  "timing": {
    "stimulus_duration_ms": 500,
    "isi_ms": 620,
    "jitter_ms": 100
  },
  "params": {
    "item_kind": "spoiled"
  }
}
